{
  "schema": "PIPD-PUBLIC-PLUGIN-MANIFEST/1",
  "plugin_id": "pipd-ls-sp-public-skills",
  "display_name": "PIPD-LS-SP Public Skills",
  "version": "0.1.1",
  "license": "Apache-2.0",
  "skills": [
    "pipd-assurance-tqaep",
    "pipd-authority-source",
    "pipd-execution-contract",
    "pipd-package-project",
    "pipd-pd-bind",
    "pipd-pi-compile",
    "pipd-profile-tailor",
    "pipd-route-intake"
  ],
  "official_schema_sha256": "OWNER_INPUT_REQUIRED",
  "publisher": {
    "name": "OWNER_INPUT_REQUIRED",
    "identity": "OWNER_INPUT_REQUIRED",
    "identity_sha256": "OWNER_INPUT_REQUIRED"
  },
  "icons": [
    {
      "path": "assets/icon-128.png",
      "sha256": "OWNER_INPUT_REQUIRED",
      "size": 128
    }
  ],
  "release": {
    "claim_ceiling": "LOCAL_PACKAGER_PASS_ONLY",
    "official_portal_verification": "NOT_EXECUTED"
  }
}
