{
  "display_name": "PIPD-LS-SP Public Skills",
  "icons": [
    {
      "path": "assets/icon-128.png",
      "sha256": "70bfddc3ebd2d6445f54f1a4258f1f0b0b787ee3a629b47900e47c3aa23a16e8",
      "size": 128
    }
  ],
  "license": "Apache-2.0",
  "official_schema_sha256": "0a4aad95ce337878ad38802ebf0daa3fde76abe3f65400c86bcbb1ec0b3ab883",
  "plugin_id": "pipd-ls-sp-public-skills",
  "publisher": {
    "identity": "https://github.com/shw097-team",
    "identity_sha256": "215388efedeec1f67023d3af8e9342cc64fd8430100e3244ae17a74e6be49523",
    "name": "shw097-team"
  },
  "release": {
    "claim_ceiling": "LOCAL_PACKAGER_PASS_ONLY",
    "official_portal_verification": "NOT_EXECUTED"
  },
  "schema": "PIPD-PUBLIC-PLUGIN-MANIFEST/1",
  "skills": [
    "pipd-assurance-tqaep",
    "pipd-authority-source",
    "pipd-execution-contract",
    "pipd-package-project",
    "pipd-pd-bind",
    "pipd-pi-compile",
    "pipd-profile-tailor",
    "pipd-route-intake"
  ],
  "version": "0.1.1"
}
